{
 "schema_version": 2,
 "desk": "Snek Sentinel",
 "book": "solada",
 "chain": "cardano",
 "unit": "ADA",
 "disclaimer": "Paper trades only: research/lottery/NFA. No real execution.",
 "ticket_size": 100,
 "default_window_hours": 48,
 "levels": {
  "1": "Pass/ignore",
  "2": "Tiny lottery only",
  "3": "Watch: lots of holders early that stick through first dip",
  "4": "High-conviction lottery: L3 + cross-chain/bigger accounts, improving ADA-side pool, holder growth through first dip, prior similar shapes worked in paper book"
 },
 "open": [],
 "closed": [
  {
   "id": "BOLT-20261017-1125",
   "ticker": "BOLT",
   "side": "cardano",
   "asset_id": "14628c260a749e78e69e58acca32d0baa09808d50388c84fa7e1ae470014df10424f4c54",
   "opened_at": "2026-10-17T11:25:00-04:00",
   "window_ends_at": "2026-10-19T11:25:00-04:00",
   "size": 100,
   "level": 3,
   "entry": {
    "mcap_ada": 530461,
    "price_ada": 0.000530461,
    "holders": 277,
    "ada_side": 34834
   },
   "thesis": [
    "277 holders, top-10 ex-pool 26%, no cluster >3.2%",
    "6h 46 buys/25 sells, +13.5% h6",
    "ADA side ~35k (up from ~32k Oct 15)",
    "SpiritSigma (5.2k) said wants to bridge for $BOLT"
   ],
   "kill_line": {
    "text": "mcap < 450k ADA or holders < 250 or ADA side < 28k",
    "mcap_ada_below": 450000,
    "holders_below": 250
   },
   "custody": "Cardano native token, non-custodial",
   "status": "closed",
   "closed_at": "2026-10-17T13:20:00-04:00",
   "exit": {
    "mcap_ada": 421252,
    "price_ada": 0.000421252,
    "holders": 264,
    "ada_side": 30598,
    "source": "on-chain Minswap V2 pool UTxO via Blockfrost; Solada /api/market 421,311"
   },
   "exit_reason": "Kill line hit: pool mcap 421k ADA < 450k stop. Holders (264) and ADA side (30.6k) were still above their lines.",
   "result": {
    "unit": "ADA",
    "pct": -20.6,
    "pnl": -20.6
   },
   "review": {
    "worked": [
     "Holder depth held: 277 -> 264, still above the 250 line",
     "ADA side held ~30.6k (above 28k)"
    ],
    "failed": [
     "Entry came right after the copy-trade-bot promo pop (+12% on flat holders); price gave it all back",
     "6h flow flipped: GeckoTerminal h6 48 buys/40 sells, h1 6 buys/12 sells, price h6 -27.6%",
     "An L3 holder base doesn't stop a ~7%-of-mcap ADA side from chopping 20% in two hours"
    ]
   },
   "rules_applied": [
    "l"
   ]
  },
  {
   "id": "CLOVE-20261017-1125",
   "ticker": "CLOVE",
   "side": "cardano",
   "asset_id": "c1b89ed48dfc2b82167c1548b88942d367af1e517947c3dd8bdead0b0014df10434c4f56452d33",
   "opened_at": "2026-10-17T11:25:00-04:00",
   "window_ends_at": "2026-10-19T11:25:00-04:00",
   "size": 100,
   "level": 3,
   "entry": {
    "mcap_ada": 314750,
    "price_ada": 0.00031475,
    "holders": 125,
    "ada_side": 26452
   },
   "thesis": [
    "+152% 24h, 6h 52 buys/34 sells, +20% h1",
    "125 holders, ADA side ~26k",
    "top-10 ex-pool 35.7%, top 5.9% (watch)"
   ],
   "kill_line": {
    "text": "mcap < 250k ADA or holders < 110",
    "mcap_ada_below": 250000,
    "holders_below": 110
   },
   "custody": "Cardano native token, non-custodial",
   "status": "closed",
   "marks": [
    {
     "at": "2026-10-17T13:20:00-04:00",
     "mcap_ada": 296954,
     "solada_mcap_ada": 275580,
     "holders": 128,
     "ada_side": 25710,
     "pct_vs_entry": -5.7,
     "top10_ex_pool": 36.4,
     "top1": 6.06,
     "gt_h6": "87 buys/41 sells, price -13.3%",
     "gt_h1": "20 buys/4 sells, price -20.2%",
     "note": "Above the 250k/110-holder stop. Team airdropped 3M+ CLOVE to holders in the last few hours (@CloveOnAscend 12:25 PM ET), so part of the holder gain is airdrop-driven (rule m). ADA side 25.7k is now just above rule k's 25k floor."
    },
    {
     "at": "2026-10-17T15:30:00-04:00",
     "mcap_ada": 261678,
     "solada_mcap_ada": 257349,
     "holders": 126,
     "onchain_holders_ex_pool": 116,
     "ada_side": 24074,
     "pct_vs_entry": -16.9,
     "top10_ex_pool": 42.85,
     "top1": 6.14,
     "gt_h6": "85 buys/37 sells, price +9.7%",
     "gt_h1": "5 buys/3 sells, price -9.7%",
     "note": "Still above the 250k/110-holder stop, about 4.7% over the mcap line. ADA side 24.1k is now under rule k's 25k entry floor. The team's wallet-drop thread is still collecting addresses on X, so holder counts stay airdrop-inflated (rule m). 116 stake keys on-chain ex-pool, still above 110. Repeat buyer addr1q9ac…u9wwut still holds 1.25%. Level cut from L3 to L2; ticket stays open because no kill line has been hit."
    },
    {
     "at": "2026-10-17T19:18:00-04:00",
     "mcap_ada": 274894,
     "solada_mcap_ada": 298567,
     "holders": 123,
     "onchain_holders_ex_pool": 114,
     "ada_side": 24326,
     "pct_vs_entry": -12.7,
     "top10_ex_pool": 42.64,
     "top1": 6.16,
     "gt_h6": "42 buys/32 sells, price +3.3%",
     "gt_h1": "2 buys/9 sells, price -28.3%",
     "note": "Ran from ~240k at 3 PM to a ~397k hourly high at 5 PM ET (+26% over entry), then gave it back: 7 of the last 9 swaps (6:55-7:18 PM) were sells. Solada holders 128 -> 126 -> 123 over three marks, on-chain stake keys 116 -> 114. Price is below entry. The team teased '$SOLADA airdrops to $CLOVE holders?' at 5:59 PM, more airdrop-style promo (rule m). ADA side 24.3k is still under rule k's 25k floor."
    }
   ],
   "level_now": 2,
   "closed_at": "2026-10-17T19:18:00-04:00",
   "exit": {
    "mcap_ada": 274894,
    "price_ada": 0.000274894,
    "holders": 123,
    "onchain_holders_ex_pool": 114,
    "ada_side": 24326,
    "source": "on-chain Minswap V2 pool UTxO via Blockfrost (~7:20 PM ET); Solada /api/market 298,567; GeckoTerminal trades"
   },
   "exit_reason": "Holders leaving (new rule o): Solada holders fell at two marks in a row (128 -> 126 -> 123, on-chain 116 -> 114) with price below entry, and the 5 PM pop was fading on 2 buys/9 sells in h1. The 250k mcap / 110-holder kill line wasn't hit; closed early under rule o instead.",
   "result": {
    "unit": "ADA",
    "pct": -12.7,
    "pnl": -12.7
   },
   "review": {
    "worked": [
     "Top holders held: no top-5 wallet sold, top-1 6.16% (stake1u9q8ncwj) unchanged",
     "Pool stayed liquid at ~24k ADA; the 5 PM spike to ~397k showed there were buyers on news"
    ],
    "failed": [
     "Airdrop-inflated holders (rule m) leaked once the airdrop window passed: 128 -> 123",
     "ADA side drifted 26.5k -> 24.3k, under rule k's floor, while mcap chopped ±30% on a few hundred ADA a swap",
     "Each pop (1 PM airdrop, 5 PM SOLADA-airdrop tease) came from team promo and faded inside two hours"
    ]
   },
   "rules_applied": [
    "m",
    "o"
   ]
  }
 ],
 "rules": [
  {
   "added_at": "2026-10-17T11:05:00-04:00",
   "rule": "Watch (L3) needs early holder density that holds through the first fade; an mcap spike alone isn't enough.",
   "source": "desk history Oct 15-17"
  },
  {
   "added_at": "2026-10-17T11:05:00-04:00",
   "rule": "KOTH loss + curve progress reversing + holder bleed = Pass (L1).",
   "source": "desk history Oct 15-17"
  },
  {
   "added_at": "2026-10-17T11:05:00-04:00",
   "rule": "Copycats appearing often mark peak attention for the original.",
   "source": "desk history Oct 15-17"
  },
  {
   "added_at": "2026-10-17T11:05:00-04:00",
   "rule": "Solada headline 24h volume can be stale post-graduation; check real pool flow over the last 6h.",
   "source": "desk history Oct 15-17"
  },
  {
   "added_at": "2026-10-17T11:05:00-04:00",
   "rule": "Holders > trades suggests airdrop/bridge/bundle distribution.",
   "source": "desk history Oct 15-17"
  },
  {
   "added_at": "2026-10-17T11:05:00-04:00",
   "rule": "Graduation alone isn't a signal: JUICE, FEED, HERO, BEAST all faded to 19-30k ADA with 60-80 holders after pools opened.",
   "source": "desk history Oct 15-17"
  },
  {
   "added_at": "2026-10-17T11:05:00-04:00",
   "rule": "Pools with an ADA side under ~11k swing 30-80% on a handful of wallets; holder count is the signal.",
   "source": "desk history Oct 15-17"
  },
  {
   "added_at": "2026-10-17T11:05:00-04:00",
   "rule": "Price rising with flat holders = Tiny lottery (L2) at best.",
   "source": "desk history Oct 15-17"
  },
  {
   "added_at": "2026-10-17T11:05:00-04:00",
   "rule": "Linked flip pair u8a2m6+u978t4 and snipers u9w6dd/uytg09zr/uyyyjqps in the first block = rotation risk; watch whether they sell into the run.",
   "source": "desk history Oct 15-17"
  },
  {
   "added_at": "2026-10-17T11:25:00-04:00",
   "id": "j",
   "rule": "First-block sniper full exit = kill trigger; IAGONAUT faded 47.8k→32.2k within ~45 min after top sniper uytg09zr sold out (Oct 17).",
   "source": "IAGONAUT Oct 17"
  },
  {
   "added_at": "2026-10-17T11:25:00-04:00",
   "id": "k",
   "rule": "Holding-tier shape: only names with 120+ holders, ADA-side ≥25k and 6h buys > sells qualify for paper tickets; post-graduation names under ~11k ADA side with 6h price down >40% (HERO -76%, JUICE -41%, ROBIN -55%) are Pass regardless of 24h headline gains.",
   "source": "run 2026-10-17 11:10"
  },
  {
   "added_at": "2026-10-17T13:45:00-04:00",
   "id": "l",
   "rule": "Promo-pop entries: don't ticket a name whose last 6h gain came from a promo/perk announcement on flat holders. Wait for the pullback and a re-hold. BOLT opened at 530k right after the copy-trade-bot promo (+12%) and hit its 450k kill within ~2h (-20.6%) while holders barely moved.",
   "source": "BOLT-20261017-1125 close"
  },
  {
   "added_at": "2026-10-17T13:45:00-04:00",
   "id": "m",
   "rule": "Team airdrops inflate holder counts: holders gained during a team airdrop window (CLOVE 3M+ airdrop, Oct 17) don't count toward rule k or L3 holder growth.",
   "source": "CLOVE Oct 17"
  },
  {
   "added_at": "2026-10-17T13:45:00-04:00",
   "id": "n",